{
  "schema_version": "1.0",
  "entry": {
    "schema_version": "1.0",
    "kind": "finite_hello_guidance",
    "entry_version": 1,
    "guidance_code": "refresh_observation",
    "context_version": "hello-guidance-v1",
    "context_sha256": "3c1ae2bc3b122b84cfaffa30841055b09f9ded059d49fa1e76bf603e94624d97",
    "scope": {
      "session_id": "session-fixture",
      "parent_runtime_id": "runtime-fixture",
      "image_id": "synthetic-image",
      "configuration_sha256": "aaaaaaaaaaaaaaaaaaaaaaaaaaaaaaaaaaaaaaaaaaaaaaaaaaaaaaaaaaaaaaaa",
      "system1_deployment_id": "fixture-decision-v1",
      "workspace_sha256": "cccccccccccccccccccccccccccccccccccccccccccccccccccccccccccccccc",
      "role": "system1"
    },
    "source": {
      "source_job_id": "job-fixture",
      "candidate_sha256": "3c45a1c7d5cd7efdd3719a66118e503a72650b602be016dd7afab782b855bf32",
      "receipt_sha256": "6ac25a1bd023f3dfd028dd0c85f45fc30d79ebebadab38b0ec28c26db4ee95ee",
      "source_sha256": "ad357f2f41afe9bccabb22a4640dd87af756c7c37d67d907fe192339f4a0e461",
      "contract": {
        "semantic_sha256": "5603a5ce2ba4a8b120881cf99e52a222a3368ca7693064d8e616ce272589e470",
        "binding_sha256": "44136fa355b3678a1146ad16f7e8649e94fb4fc21fe77e8310c060f61caaff8a"
      }
    },
    "execution_authorized": false,
    "causality_verified": false,
    "gold": false,
    "training_ready": false
  },
  "entry_sha256": "71dbfaf66471466046634952fecb9e7e9952db06b482f96b0408d0257eebb181",
  "guidance": {
    "manual_approval_required": true,
    "guidance_applied": false,
    "causality_verified": false,
    "gold": false,
    "training_ready": false,
    "schema_version": "1.0",
    "followup": {
      "manual_approval_required": true,
      "guidance_applied": false,
      "causality_verified": false,
      "gold": false,
      "training_ready": false,
      "schema_version": "1.0",
      "attempt_id": "followup-33d27603ed2b49cfab9cdb963721f253",
      "source_job_id": "job-fixture",
      "candidate_sha256": "3c45a1c7d5cd7efdd3719a66118e503a72650b602be016dd7afab782b855bf32",
      "receipt_sha256": "6ac25a1bd023f3dfd028dd0c85f45fc30d79ebebadab38b0ec28c26db4ee95ee",
      "source_sha256": "ad357f2f41afe9bccabb22a4640dd87af756c7c37d67d907fe192339f4a0e461",
      "target": {
        "session_id": "session-fixture",
        "parent_runtime_id": "runtime-fixture",
        "image_id": "synthetic-image",
        "lease_id": "lease-fixture",
        "generation": 0,
        "task_kind": "hello",
        "configuration_sha256": "aaaaaaaaaaaaaaaaaaaaaaaaaaaaaaaaaaaaaaaaaaaaaaaaaaaaaaaaaaaaaaaa",
        "system1_deployment_id": "fixture-decision-v1",
        "system2_deployment_id": null
      },
      "source_contract": {
        "semantic_sha256": "5603a5ce2ba4a8b120881cf99e52a222a3368ca7693064d8e616ce272589e470",
        "binding_sha256": "44136fa355b3678a1146ad16f7e8649e94fb4fc21fe77e8310c060f61caaff8a"
      },
      "correction_code": "refresh_observation",
      "confirm_sha256": "a3a865851e7022c95365db63b7c2ecade0ff3403dbbc48807147b82df82bb4bc"
    },
    "guidance_code": "refresh_observation",
    "context_version": "hello-guidance-v1",
    "context_sha256": "3c1ae2bc3b122b84cfaffa30841055b09f9ded059d49fa1e76bf603e94624d97",
    "confirm_sha256": "1f64548c1441f728a8a7d46c76c2821cd601b1edab02281bc8db592bd1d17cfb"
  },
  "manual_approval_required": true,
  "execution_authorized": false,
  "causality_verified": false,
  "gold": false,
  "training_ready": false,
  "confirm_sha256": "f0e807bb138a406fa87032abf25b1788fe7152c97db7922741b74639f1980b91"
}
